{
  "format": "graph-studio",
  "version": 2,
  "diagram": "dag",
  "title": "Mathematical Logic and Foundations",
  "metadata": {},
  "nodes": {
    "Function": {
      "title": "Function",
      "type": "Mathematical Logic and Foundations",
      "define": "A function assigns each input exactly one output.",
      "notes": "[Read concept note](./notes/Function.md)"
    },
    "Logic": {
      "title": "Logic",
      "type": "Mathematical Logic and Foundations",
      "define": "Logic studies formal languages, truth conditions, and inference rules for valid reasoning.",
      "notes": "[Read concept note](./notes/Logic.md)"
    },
    "Relation": {
      "title": "Relation",
      "type": "Mathematical Logic and Foundations",
      "define": "A relation records which ordered tuples of elements are considered related.",
      "notes": "[Read concept note](./notes/Relation.md)"
    },
    "Sequence": {
      "title": "Sequence",
      "type": "Analysis",
      "define": "A sequence is a function whose domain is usually the natural numbers, listing objects in order.",
      "notes": "[Read concept note](./notes/Sequence.md)"
    },
    "Set": {
      "title": "Set",
      "type": "Mathematical Logic and Foundations",
      "define": "A set is a collection of distinct objects considered as a single mathematical object.",
      "notes": "[Read concept note](./notes/Set.md)"
    },
    "Real_Valued_Function": {
      "title": "Real Valued Function",
      "type": "Analysis",
      "define": "A real-valued function assigns a real number to each point of its domain.",
      "notes": "[Read concept note](./notes/Real_Valued_Function.md)"
    },
    "Real_Valued_Sequence": {
      "title": "Real Valued Sequence",
      "type": "Mathematical Logic and Foundations",
      "define": "A real-valued sequence is an ordered family of real numbers indexed by the natural numbers.",
      "notes": "[Read concept note](./notes/Real_Valued_Sequence.md)"
    }
  },
  "edges": [
    {
      "id": "math-66",
      "source": "Function",
      "target": "Sequence",
      "value": "subtype_of"
    },
    {
      "id": "math-67",
      "source": "Function",
      "target": "Real_Valued_Function",
      "value": "subtype_of"
    },
    {
      "id": "math-69",
      "source": "Relation",
      "target": "Function",
      "value": "subtype_of"
    },
    {
      "id": "math-131",
      "source": "Set",
      "target": "Relation",
      "value": "subtype_of"
    },
    {
      "id": "math-136",
      "source": "Sequence",
      "target": "Real_Valued_Sequence",
      "value": "related_to"
    },
    {
      "id": "math-142",
      "source": "Real_Valued_Function",
      "target": "Real_Valued_Sequence",
      "value": "related_to"
    }
  ]
}
